{
  "narmesteLederId": "0199b8f1-0cfe-7787-bab8-2fb1cf1b4767",
  "fnr": "15436803416",
  "orgnummer": "215649202",
  "narmesteLederFnr": "13468329780",
  "narmesteLederTelefonnummer": "12346532",
  "narmesteLederEpost": "e@post.no",
  "arbeidsgiverForskutterer": "false",
  "aktivFom": "2025-10-06",
  "aktivTom": "2025-10-06",
  "timestamp": "2025-10-06T11:50:52.433859Z",
  "status": "DEAKTIVERT_ARBEIDSTAKER"
}
